event,eventLabel,date,start_date,end_date,countryLabel,locationLabel,participantLabel,biggerWarInstanceLabel,smallerWarInstanceLabel,casualties,isReligious,isCivil
http://www.wikidata.org/entity/Q37643,Gulf War,,1990-08-02T00:00:00Z,1991-02-28T00:00:00Z,,"Kuwait, Israel, Saudi Arabia, Arabian Peninsula, Iraq","Kuwait, Jaber al-Ahmad al-Sabah, Ba'athist Iraq, United Kingdom, Saddam Hussein, Margaret Thatcher, United States of America, France, Saudi Arabia, John Major, George H. W. Bush, Australia",,"Battle of Rumaila, Battle of Norfolk, Operation Desert Storm, Liberation of Kuwait campaign, Battle of Khafji, timeline of the Gulf War, Safwan Airfield Standoff, Invasion of Kuwait, Iraqi rocket attacks on Israel, Battle of 73 Easting, Battle of Ad-Dawrah, Battle of Kuwait International Airport, Battle of Wadi Al-Batin, Battle of Phase Line Bullet, Battle of Medina Ridge, Package Q Strike, Battle of the Bridges, Battle for Jalibah Airfield, Operation Friction, Battle of Failaka, Geneva Peace Conference, Operazione Locusta, Gulf War air campaign, Battle of Qurah and Umm al Maradim, Battle of Bubiyan, Operation Desert Farewell, Battle of Al Busayyah, Battle of Dasman Palace, Operation Desert Shield, Air engagements of the Gulf War, Highway of Death",,no,no
http://www.wikidata.org/entity/Q39194,Spanish reconquest of Santo Domingo,1808-11-07T00:00:00Z,1808-11-07T00:00:00Z,1809-07-09T00:00:00Z,,Captaincy General of Santo Domingo,"First French Empire, United Kingdom of Great Britain and Ireland, Captaincy General of Santo Domingo",Napoleonic Wars,,,no,no
http://www.wikidata.org/entity/Q40837,Anglo-Afghan Wars,,,,"Afghanistan, British Empire",,,,"Third Anglo-Afghan War, First Anglo-Afghan War, Second Anglo-Afghan War",,no,no
http://www.wikidata.org/entity/Q46083,Franco-Prussian War,1871-01-28T00:00:00Z,1870-07-19T00:00:00Z,1871-05-10T00:00:00Z,,France,"Second French Empire, Grand Duchy of Baden, French Third Republic, German Empire, Kingdom of Württemberg, Kingdom of Bavaria, North German Confederation",Unification of Germany,"Battle of Montmesly, Battle of Beaumont, Battle of Le Mans, Battle of Loigny-Poupry, Battle of Bazeilles, Battle of Noisseville, Battle of Longeau, Battle of Bretoncelles, Second Battle of Orléans, Battle of Amiens, Siege of Phalsbourg, Battle of Mars-la-Tour, Battle of Bapaume, Battle of Spicheren, Bitche during the siege of 1870-1871, Battle of Havana, Lichtenberg Siege, Battle of Saarbrücken, Siege of Metz, Battle of Le Bourget, Battle of Wissembourg, Siege of Paris, Battle of Artenay, Siege of Montmédy, Battle of Sedan, Battle of Borny-Colombey, Battle of Villersexel, Battle of Coulmiers, Siege of Neu-Breisach, Battle of Villepion, Siege of Verdun (1870), Battle of Nuits, Battle of Beaugency, Battle of the Lisaine, Siege of La Fère, Siege of Thionville, Siege of Mézières (1870–1871), Siege of Belfort, Battle of Châteaudun, Battle of Beaune-la-Rolande, Battle of Buzenval (1871), Battle of Châtillon, order of battle of the Battle of Wissembourg, Battle of Choisy-le-Roi, Battle of Bellevue, Battle of Dijon, Battle of Gravelotte, Siege of Strasbourg, Battle of St. Quentin, Battle of Chevilly, Siege of Péronne, Siege of Toul, Battle of Villiers, Battle of Hallue, Battle of Wörth, Siege of Marsal, Battle of Sceaux, Battle of Nouart, Battle of Buzancy, Battle of Buzenval (1870), Battle of Nompatelize, Second Battle of Le Bourget, Battle of Pontarlier",,no,no
http://www.wikidata.org/entity/Q47985,Rus'–Byzantine War (1043),1043-01-01T00:00:00Z,,,,,"Yaroslav the Wise, Vladimir of Novgorod, Kievan Rus'",,,,no,no
http://www.wikidata.org/entity/Q48249,Falklands War,1982-01-01T00:00:00Z,1982-04-02T00:00:00Z,1982-06-14T00:00:00Z,,"Falkland Islands, South Georgia and the South Sandwich Islands","Argentina, United Kingdom",Falkland Islands sovereignty dispute,"1982 British Army Gazelle friendly fire incident, Mount Kent Skirmish, Operation Mikado, Battle of Seal Cove, Attack on HMS Invincible, Operation Rosary, Battle of Port Stanley, Argentine air forces in the Falklands War, Raid on Pebble Island, Battle of Mount Longdon, Attack on ARA Alférez Sobral, battle for Stanley, Battle of San Carlos, Bombing of Mount Kent, Invasion of South Georgia, Skirmish at Many Branch Point, Sinking of ARA General Belgrano, Battle of Mount Tumbledown, Battle of Two Sisters, Planned atomic bombing of Córdoba, The Sinking of HMS Sheffield, Operation Paraquet, Operation Keyhole, Bluff Cove Air Attacks, Battle of Murrell Bridge, Battle of Goose Green, Battle of Mount Harriet, Operation Sutton, Battle of Wireless Ridge, Operation Black Buck, Bombing of Two Sisters, Skirmish at Top Malo House",891,no,no
http://www.wikidata.org/entity/Q48883,Goguryeo–Sui War,,0598-01-01T00:00:00Z,0614-01-01T00:00:00Z,,Manchuria,"Sui dynasty, Goguryeo",,"Second Goguryeo–Sui War, Battle of Linyuguan, First Goguryeo–Sui War, Fourth Goguryeo–Sui War, Third Goguryeo–Sui War",,no,no
http://www.wikidata.org/entity/Q49077,Six-Day War,1967-06-10T00:00:00Z,1967-06-05T00:00:00Z,1967-06-10T00:00:00Z,,Middle East,"Israel, Syria, Lebanon, Egypt, Iraq, Jordan",Arab–Israeli conflict,"The liberation of Jerusalem in the Six-Day War, Battle of Ammunition Hill, Battle of Abu-Ageila, 19th Battalion Night Post Battle, Jordanian campaign, Ras Sedr massacre, USS Liberty incident, Battle of the Jiradi, Operation Focus, Battle of Tel Azaziat",,no,no
http://www.wikidata.org/entity/Q49092,1948 Arab–Israeli War,1940-01-01T00:00:00Z,1948-05-15T00:00:00Z,1949-03-10T00:00:00Z,Palestine,"Palestine, Sinai Peninsula, Southern Lebanon","Israel, Arab Liberation Army, Arab League, Army of the Holy War, David Ben-Gurion, Israel Defense Forces",1948 Palestine war,"Operation Ha-Har, Battle of 'Auja, battles of the Separation Corridor, Operation Avak, Operation Lot, Operation An-Far, The Jewish Mentalli Ill Patient Affair at Beit Lechem, Operation Shmone, Operation Death to the Invader, Battle of Hill 86, Battle of Rafah, Operation Ben-Ami, Battles of the Sinai, Battle of Nitzanim, Battle of Be'erot Yitzhak, Operation Velvetta, Qaqun, Operation Pleshet, Battles of Latrun, Operation Horev, Battles of Malkia, Israeli-British clash of January 7, 1949, Battles of Bir 'Asluj, Operation Hiram, Operation GYS, Bombing of Tel Aviv in the Arab-Israeli War of 1948, Battle of Beersheba, Operation Yoav, Battle of Nirim, Altalena Affair, Battles of Negba, Operation Shoter, Operation Uvda, Battles of the Kinarot Valley, Battle of Yad Mordechai, Battles of Kfar Darom, Operation Danny",,no,no
http://www.wikidata.org/entity/Q49097,1948 Palestine war,1940-01-01T00:00:00Z,1947-11-30T00:00:00Z,1949-07-20T00:00:00Z,"Israel, British Empire",Levant,"Israel, Arab Liberation Army, Haganah, Yishuv, Kingdom of Iraq, Lebanon, Lehi, Kingdom of Egypt, Palmach, Army of the Holy War, Irgun, First Syrian Republic, Jordan",,"1947–1948 civil war in Mandatory Palestine, Abu Shousha attack, 1948 Palestinian exodus, 1948 Arab–Israeli War, Norris battle, Battle of Notre Dame Hospice, Battle for Jerusalem, Battle of 3 Shevat, Atarot convoy, declaration of Israeli independence, Mission of Yaakov Bukai",,no,no
http://www.wikidata.org/entity/Q49100,Yom Kippur War,1973-01-01T00:00:00Z,1973-10-06T00:00:00Z,1973-10-25T00:00:00Z,,"Suez Canal, Middle East, Golan Heights, Sinai Peninsula","Mustafa Tlass, Israel, Syria, Ahmad Ismail Ali, Benny Peled, Palestine Liberation Organization, Yitzhak Hofi, Haim Bar-Lev, Israel Tal, Ali Aslan, Pakistan Air Force, Muhammad Abd El-Ghani El-Gamasy, United States of America, Moshe Dayan, Egypt, David Elazar, Shmuel Gonen, Saad el-Shazly",Arab–Israeli conflict,"Battles of Fort Budapest, Ofira Air Battle, Operation Tagar, 1973 al-Mazzah Airport Raid, Second Battle of Mount Hermon, Egyptian Commando attack at Sinai, Operation Gown, Operation Abirey-Halev, Battle of Latakia, Battle of the Sinai, Valley of Tears, Battle of Wadi Mabouk, Operation Nickel Grass, Egyptian 25th Brigade ambush, Battle of Fort Lahtzanit, Operation Model 5, War of Attrition in the Bashan Salient, Israeli Artillery Corps at Yom Kippur War, Battle of Marsa Talamat, Operation Or Yarok, Battle of Baltim, Third Battle of Mount Hermon, Air Battle of El Mansoura, 143th Division during Yom Kippur War, 1973 raid on Egyptian missile bases, Battle of Ismailia, Battle of the Chinese Farm, 1973 Syrian General Staff Headquarters Raid, Israeli Medals and Decorations of the Yom Kippur War, First Battle of Mount Hermon, Operation Badr, Israeli Missing Soldiers of the Yom Kippur War, Romani ambush, Battle of Suez, Prisoners at the Yom Kippur War",,no,no
http://www.wikidata.org/entity/Q49101,Suez Crisis,1957-03-01T00:00:00Z,1956-10-29T00:00:00Z,1956-11-07T00:00:00Z,,Sinai Peninsula,"Israel, France, Egypt, United Kingdom","Cold War, Arab–Israeli conflict","Operation Tarnegol, Operation Yona, Operation Musketeer",,no,no
http://www.wikidata.org/entity/Q49103,1982 Lebanon War,,1982-06-06T00:00:00Z,1985-05-17T00:00:00Z,,Lebanon,"Israel, South Lebanon Army, Syria, Islamic Unification Movement, Palestine Liberation Organization, Lebanese National Resistance Front, Armenian Secret Army for the Liberation of Armenia, Amal Movement, Al-Mourabitoun, Kurdistan Workers' Party, Lebanese Front, Hezbollah, Islamic Amal",Israeli–Lebanese conflict,"Orech Ruach operetion, Operation Mole Cricket 19, Tyre headquarters bombings, Battle of Jezzine, Siege of Beirut, 1984 Sohmor massacre, Battle of the Beaufort, Battle of Sultan Yacoub",,no,no
http://www.wikidata.org/entity/Q49104,2006 Lebanon War,2006-01-01T00:00:00Z,2006-07-12T00:00:00Z,2006-08-14T00:00:00Z,"Lebanon, Israel",Levant,"Lebanese Communist Party, Popular Front for the Liberation of Palestine – General Command, Amal Movement, Hezbollah, Israel Defense Forces","Israeli–Lebanese conflict, Iran–Israel proxy conflict","Battle of Ayta ash-Shab, Operation Density, Operation Change of Direction 11, Battle of Bint Jbeil, Marjayoun convoy incident, foreign involvement in the 2006 Lebanon War, Operation Sharp and Smooth, Operation Highbrow, Operation Beach Boys, 2006 Hezbollah cross-border raid, Battle of Maroun al-Ras, timeline of the 2006 Lebanon War, Tyre raid","1191, 165",no,no
http://www.wikidata.org/entity/Q51650,People's Crusade,1096-10-01T00:00:00Z,1096-04-01T00:00:00Z,1096-10-01T00:00:00Z,,"Anatolia, Central Europe",,Crusades,Battle of Civetot,,no,no
http://www.wikidata.org/entity/Q54434,War of Jenkins' Ear,1739-10-22T00:00:00Z,1739-10-22T00:00:00Z,1748-10-18T00:00:00Z,,Viceroyalty of New Granada,"British Empire, Spain",War of the Austrian Succession,"Battle of La Guaira, Action of 8 April 1740, Attacks on Fuerteventura in 1740, Battle of Bloody Marsh, Siege of Fort Mose, Action of 18 March 1748, Invasion of Georgia, Georgia Experiment, Battle of Havana (1748), Battle of Puerto Cabello, Voyage of the Glorioso, Battle of Porto Bello, Battle of Santiago de Cuba, Battle of Cartagena de Indias",,no,no
http://www.wikidata.org/entity/Q58947,Paraguayan War,1864-10-12T00:00:00Z,1864-12-27T00:00:00Z,1870-03-01T00:00:00Z,,Southern Cone,"Triple Alliance, Argentina, Empire of Brazil, Paraguay, Uruguay",Platine Wars,"Campaign of the Hills, Battle of Riachuelo, Battle of Piribebuy, Humaitá Campaign, Second Battle of Tuyutí, Mato Grosso Campaign, Treaty of the Triple Alliance, Battle of Tatayibá, Battle of Curuzú, Invasion of Rio Grande do Sul, Battle of Tuyutí, Pikysyry maneuver, Coimbra Fort Skirmish, Sacking of Asunción, Battle of Yataity Corá, Passage of Humaitá, Battle of Corrientes, Siege of Uruguaiana, Assault on the battleships Cabral and Lima Barros, Siege of Humaitá, Siege of Curupaiti, Corrientes Campaign, Battle of Potrero Obella, Bataille d’Itapiru, Battle of Avay, battle of the Paraguayan War, August 30 protest, Victoria de paraguay, Battle of Estero Bellaco, Capture of Anhambai, Toledo Desertion, Battle of Lomas Valentinas, Battle of Curupaity, Dezembrada, Battle of Corrales, Battle of Cerro Corá, Basualdo Desertion, Battle of Ytororó, Battle of Yatay, Battle of Boquerón, Laguna Retreat, Battle of Acayuazá, Pikysyry Campaign, Battle of Paso de Mercedes, Battle of Paso de Cuevas",1000000,no,no
http://www.wikidata.org/entity/Q60489,Albanian–Venetian War,1447-12-01T00:00:00Z,1447-12-01T00:00:00Z,1448-10-04T00:00:00Z,,Albania,"Ottoman Empire, Republic of Venice, League of Lezhë",,Battle of Oranik,,no,no
http://www.wikidata.org/entity/Q68969,Croatian War of Independence,1995-11-12T00:00:00Z,1991-03-31T00:00:00Z,1995-08-07T00:00:00Z,Croatia,Croatia,"Republic of Serbia, Republic of Serbian Krajina, Republika Srpska, Croatia, Socialist Federal Republic of Yugoslavia, Republic of Bosnia and Herzegovina, Yugoslav People's Army",Yugoslav Wars,"Ivanovo Selo massacre, Operation Tiger (1992), Operation Swath-10, Operation Summer '95, Operation Winter '94, Operation Maslenica, Battle of Kusonje, Miljevci plateau incident, Operation Stinger, Battle of Glina, Operation Orkan 91, 1991 Yugoslav campaign in Croatia, Operation Alfa, Battle of Logorište, Voćin massacre, Battle of Zadar, Operation Medak Pocket, Operation Whirlwind, 1991 killings of Serbs in Vukovar, Battle of Vukovar, Battle of Osijek, Operation Flash, Borovo Selo killings, Operation Opera Orientalis, Plitvice Lakes incident, Zagreb rocket attacks, Operation Storm, Battle of the Dalmatian channels, Siege of Bihać, Vance plan, Battle of Šibenik, Operation Jackal, 1991 siege of Kijevo, Baćin massacre, Operation Orada, Battle of Gospić, Split Agreement, Siege of Dubrovnik, Evacuation of Karin military base, Pakrac clash, Battle of the Barracks",,no,no
http://www.wikidata.org/entity/Q74109,World War II in Albania,1942-01-01T00:00:00Z,1939-01-01T00:00:00Z,1944-01-01T00:00:00Z,,Italian protectorate of Albania,"Balli Kombëtar, Kingdom of Italy, Italian protectorate of Albania, Nazi Germany, Albanian Kingdom, Legality Movement, National Liberation Movement","World War II, resistance during World War II","Battle of Gjorm, National Liberation Movement, Battle of Drashovica, Kurtës Ambush",,no,no
http://www.wikidata.org/entity/Q74298,Polish–Ottoman War of 1672–1676,1672-01-01T00:00:00Z,1672-01-01T00:00:00Z,1676-01-01T00:00:00Z,,"Right-bank Ukraine, Galicia","Polish–Lithuanian Commonwealth, Principality of Moldavia, Ottoman Empire, Cossack Hetmanate, Crimean Khanate, Wallachia",Polish–Ottoman wars,"Battle of Khotyn, Lipka Rebellion, Treaty of Buchach, Treaty of Żurawno, Battle of Lwów, Siege of Kamenets, Battle of Krasnobród, Battle of Ładyżyn, Battle of Trembowla, Battle of Żurawno",,no,no
http://www.wikidata.org/entity/Q74302,Polish–Ottoman War of 1633–34,1633-01-01T00:00:00Z,1633-01-01T00:00:00Z,1634-01-01T00:00:00Z,,Ukraine,"Polish–Lithuanian Commonwealth, Ottoman Empire",Polish–Ottoman wars,,,no,no
http://www.wikidata.org/entity/Q74623,Great Turkish War,,1683-01-01T00:00:00Z,1699-01-01T00:00:00Z,,Austria,"Serbs, Polish–Lithuanian Commonwealth, Holy Roman Empire, Prince-Bishopric of Montenegro, Bulgarians, Ottoman Empire, Habsburg monarchy, Greeks, Tsardom of Russia, Albanians, Duchy of Mantua, Republic of Venice",Ottoman–Habsburg wars,"Battle of Eperjes, Battle of Mohács, Battle of Niš, Battle of Ustechko, Morean War, Battle of Kassa (1685), Battle of Zernest, Siege of Buda (1684), Russo-Turkish War (1686–1700), Sacking of Sarajevo, Fire of Skopje 1689, Battle of Párkány, Battle of Batočina, Battle of Zenta, Battle of Slankamen, Battle of Vác, Siege of Érsekújvár, Battle of Cenei, Battle on Vrtijeljka, treaty of Karlowitz, Siege of Belgrade, Battle of Buda, Moreazug, Battle of Štip, Battle of Ulaş, Siege of Pécs, Battle of Podhajce, Battle of Lugos, Croatian-Slavonian-Dalmatian theater in Great Turkish War, Battle of Vienna",,no,no
http://www.wikidata.org/entity/Q75626,First Macedonian War,,-0213-01-01T00:00:00Z,-0204-01-01T00:00:00Z,,Macedonia,"Aetolian League, Attalid dynasty, Ancient Elis, Messenia, Achaean League, list of Illyrians, Sparta, Ancient Rome, Macedonia",Macedonian Wars,"Battle of Lissus, First Battle of Lamia, Battle of Mantinea, Battle of Apollonia, Second Battle of Lamia, Siege of Echinus",,no,no
http://www.wikidata.org/entity/Q75665,Second Macedonian War,,-0199-01-01T00:00:00Z,-0196-01-01T00:00:00Z,,Greece,"Aetolian League, Attalid dynasty, Macedonia, Rhodes, Ancient Rome, Kingdom of Dardania, Classical Athens",Macedonian Wars,"Siege of Leukas, Siege of Corinth (198 BC), Battle of Alabanda, Battle of Cynoscephalae, Battle of the Aous",,no,no
http://www.wikidata.org/entity/Q75756,Second Congo War,2003-07-18T00:00:00Z,1998-08-02T00:00:00Z,2003-06-30T00:00:00Z,,Democratic Republic of the Congo,"Banyamulenge, National Union for the Total Independence of Angola, Chad, Namibia, Rally for Congolese Democracy, Movement for the Liberation of the Congo, Democratic Forces for the Liberation of Rwanda, Rwanda, Angola, Lord's Resistance Army, Uganda, Union of Congolese Patriots, National Council for the Defense of Democracy–Forces for the Defense of Democracy, Burundi, Forces for Renewal, Sudan, Democratic Republic of the Congo, Zimbabwe, Rally for Congolese Democracy–Goma, National Liberation Front",Congo Civil War,"Effacer le tableau, Six-Day War, Kisangani massacre, Ituri conflict, Operation Kitona, rape during the Congo civil wars",,no,no
http://www.wikidata.org/entity/Q76118,Third Macedonian War,,-0170-01-01T00:00:00Z,-0167-01-01T00:00:00Z,,Illyria,"Aetolia, Numidia Kingdom, Epirus, Attalid dynasty, Lucius Aemilius Paullus Macedonicus, Odrysian kingdom, Achaean League, Athamania, Perseus of Macedon, Thessalia, Ancient Rome, Eumenes II, Macedonia",Macedonian Wars,"Battle of Callinicus, Battle of Pydna",,no,no
http://www.wikidata.org/entity/Q80330,English Civil War,,1642-01-01T00:00:00Z,1651-09-03T00:00:00Z,,Kingdom of England,"Oliver Cromwell, Cavalier, Charles I of England, Roundhead",Wars of the Three Kingdoms,"Protestant Revolution, Battle of Stow-on-the-Wold, Anglo-Scottish war (1650–1652), Siege of Portsmouth, Plundering Time, Battle of Naseby, Battle of Worcester, Battle of Alton, Trial of Charles I, King of England, Scotland and Ireland, Battle of Rowton Heath, Battle of Kings Norton, First Battle of Middlewich, Battle of Marston Moor, Second English Civil War, Siege of Basing House, Battle of Boldon Hill, Siege of Bristol, Relief of Newark, Execution of Charles I, Bolton Massacre, Battle of Roundway Down, Battle of Sourton Down, First English Civil War, 1642, Battle of Cropredy Bridge, Heads of Proposals, Battle of Weymouth, Battle of Cheriton, First English Civil War, Siege of York, Storming of Bristol, Scotland in the Wars of the Three Kingdoms, Battle of Ripple Field, Battle of Ormskirk, Siege of Chichester",,no,no
http://www.wikidata.org/entity/Q82664,Iran–Iraq War,1980-09-22T00:00:00Z,1980-09-22T00:00:00Z,1988-08-20T00:00:00Z,,"Iran, Persian Gulf, Iraq","People's Mojahedin Organization of Iran, Democratic Revolutionary Front for the Liberation of Arabistan, Iran, Patriotic Union of Kurdistan, Islamic Supreme Council of Iraq, Democratic Party of Iranian Kurdistan, Sudan, Kurdistan Democratic Party, Iraq",Gulf War,"Operation Muslim ibn Aqil, Tawakkul Operation, Iraqi attack on USS Stark, Operation Dawn-4, Operation Karbala-2, Operation Karbala 10, Operation Praying Mantis, Operation Karbala-6, Operation Dawn 10, Operation Tariq al-Qods, Operation Dawn 9, Battle of Khorramshahr, Aerial bombing of Chavar football ground, Operation Dawn 5, Operation Undeniable Victory, Operation Before the Dawn, Operation Beit ol-Moqaddas, Operation Muharram, Tanker War, Operation Zafar 7, Operation Kheibar, Operation Prime Chance, Operation Ashura, Chemical bombing of Sardasht, Siege of Basra, Siege of Abadan, Iran–U.S. naval skirmish on  8 October 1987, Liberation of Susangerd, Operation Beit ol-Moqaddas 4, Bilat al-Shuhada strike, chemical attack on Behbahan battalion, Operation Karbala-8, War of the Cities, Operation Dawn 6, Operation Nimble Archer, Operation Karbala-4, Battle of Mehran, Operation Karbala-3, Operation Soltan 10, First Battle of al-Faw, Operation Ramadan, Operation Beit ol-Moqaddas 3, Operation Samen-ol-A'emeh, Operation Karbala-7, Tankers War, Operation Dawn 3, Operation Mersad, Operation Revenge, Operation Aftab, Attack on H3, Liberation of Khorramshahr, Battle of Dezful, Battle of the Marshes, Operation Kaman 99, Operation Morvarid, Operation Beit ol-Moqaddas 2, Operation Fath 1, Iranian shoot-down of Iraqi MiG-25, Tawakalna ala Allah Operations, Operation Dawn, Operation Nasr 4, Bombing of Andimeshk, Operation Badr, Bombing of Dowletu Prison, Iraqi invasion of Iran, Operation Forty Stars, Operation Dawn 2, Operation Earnest Will, Operation Dezful, Operation Dawn 8",,no,no
http://www.wikidata.org/entity/Q83085,Soviet–Afghan War,,1979-12-25T00:00:00Z,1989-02-15T00:00:00Z,,Democratic Republic of Afghanistan,"Islamic Unity of Afghanistan Mujahideen, Tehran Eight, Democratic Republic of Afghanistan, Soviet Union",Afghanistan conflict,"Padkhwab-e Shana massacre, Kulchabat, Bala Karz and Mushkizi massacre, 1980 student protests in Kabul, Battles of Zhawar, Rauzdi massacre, Baraki Barak massacre, Tajbeg Palace assault, Operation Magistral, Siege of Urgun, Operation Curtain, Laghman massacre, Siege of Khost, Battle for Hill 3234, Battle of Jaji, Kunduz massacre, Soviet withdrawal from Afghanistan, Badaber Uprising, Panjshir offensives, Battle of Arghandab, Operation Cyclone, 3 Hoot uprising, Operation Arrow, Marmoul offensives, Battle of Maravar Pass, Operation Trap",,no,no
http://www.wikidata.org/entity/Q87138,Greco-Turkish War (1919–1922),1922-10-11T00:00:00Z,1919-05-15T00:00:00Z,1922-10-11T00:00:00Z,,Anatolia,,Turkish War of Independence,"Raid on Erikli, Raid on Erbeyli, Malgaç Raid, Raid on Bergama, Battle of the Gediz, First Battle of İnönü, Battle of Aydın, Great Offensive, Urla Clashes, Battle of Tellidede, Second Battle of İnönü, Yalova Peninsula Massacres, Battle of Sakarya, Battle of Kütahya–Eskişehir, Liberation of Balıkesir, Greek Summer Offensive, Greek landing at Smyrna, Turkish capture of Smyrna",,no,no
http://www.wikidata.org/entity/Q94916,Second Italo-Ethiopian War,1935-10-03T00:00:00Z,1935-10-03T00:00:00Z,1937-02-19T00:00:00Z,,Ethiopian Empire,"Kingdom of Italy, Ethiopian Empire",interwar period,"Gondrand massacre, De Bono's invasion of Abyssinia, Dolo hospital airstrike, Battle of Maychew, Battle of Shire, Lekemti massacre, First Battle of Tembien, Hoare–Laval Pact, Battle of Amba Aradam, March of the Iron Will, Battle of Genale Doria, Ethiopian Christmas Offensive, Battle of the Ogaden, Second Battle of Tembien","20000, 275000",no,no
http://www.wikidata.org/entity/Q120843,Second Chechen War,,1999-08-26T00:00:00Z,2009-04-16T00:00:00Z,Russia,Chechnya,"Mujahideen in Chechnya, Russia, Caucasus Emirate, Caucasian Front, Vladimir Putin, Georgia, Chechen Republic of Ichkeria",Chechen–Russian conflict,"Elistanzhi cluster bomb attack, Battle of Galashki, Galashki ambush, 2004 Grozny raid, 1999 Russian apartment bombings, Staropromyslovsky massacre, Insurgency in Ingushetia, 2004 Grozny stadium bombing, 2005 Nalchik raid, Borozdinovskaya operation, 2006 Avtury ambush, Battle of Vedeno, 1999 Russian bombing of Chechnya, death of Nura Luluyeva, Novye Aldi massacre, Ingush–Chechen fratricide incident, 2002 Grozny OMON ambush, Alkhan-Kala operation, 2007 Zhani-Vedeno ambush, Chechnya Spetsnaz base explosion, Bombing of Katyr-Yurt, Battle of Komsomolskoye, Battle of Grozny, Gorets mutiny, 1999 Grozny refugee convoy shooting, Grozny OMON fratricide incident, Baku-Rostov highway bombing, Battle of Duba-Yurt, 2000 Zhani-Vedeno ambush, Battle for Height 776, 2003 Tushino bombing, Komsomolskoye massacre, Guerrilla phase of the Second Chechen War, January 2005 Dagestan Raids, Tsotsin-Yurt operation, Alkhan-Yurt massacre, 2004 Nazran raid, Gimry fighting, 2004 Avtury raid",,no,no
http://www.wikidata.org/entity/Q122100,Continuation War,1944-09-19T00:00:00Z,1941-06-25T00:00:00Z,1944-09-19T00:00:00Z,,Finland,"Nazi Germany, Finland, Soviet Union","World War II, Eastern Front","Battle of Tali-Ihantala, Battle of Nietjärvi, Aakenustunturi flight accident, Vyborg–Petrozavodsk Offensive, Raid on Kirkenes and Petsamo, Battle of Bengtskär, Battle of Ilomantsi, Öykkösenvaara battle, Battle of Hanko, Finnish reconquest of the Karelian Isthmus, Battle of Someri, Battle of Porlampi, Finnish invasion of East Karelia, Battle of Tienhaara, Battle of Suursaari",,no,no
http://www.wikidata.org/entity/Q123070,Russo-Turkish War (1768–1774),1701-01-01T00:00:00Z,1768-01-01T00:00:00Z,1774-01-01T00:00:00Z,,Eastern Europe,"Ottoman Greece, Ottoman Empire, Kingdom of Kartli-Kakheti, Kingdom of Imereti, Russian Empire, Egypt Eyalet",Russo-Turkish wars,"Battle of Toprakada, Battle of Chios, Orlov Revolt, Battle of Bodrum, First Archipelago Expedition, Action of 20 June 1774, Battle of Kozludzha, Action of 6 November 1772, Russian occupations of Beirut, Battle of Chesma, Battle of Monemvasia, Siege of Khotyn, Battle of Nauplia (1770), Battles of Bodrum and Kos",,no,no
http://www.wikidata.org/entity/Q123210,Russo-Turkish War (1787–1792),,1787-08-24T00:00:00Z,1792-01-09T00:00:00Z,"Russian Empire, Ottoman Empire",Eastern Europe,"Russian Empire, Ottoman Empire, Holy Roman Empire",Russo-Turkish wars,"Battle of Andros, Battle of Măcin, Battle of Cape Kaliakra, Battle of Kerch Strait, Siege of Izmail, Siege of Anapa (1791), Naval actions at the siege of Ochakov, Battle of Kinburn, Battle of Rymnik, Battle of Ochakiv, Siege of Ochakov, Souliote War (1789–1793), Battle of Focșani, Battle of Fidonisi",,no,no
