event,eventLabel,date,start_date,end_date,countryLabel,locationLabel,participantLabel,biggerWarInstanceLabel,smallerWarInstanceLabel,casualties,isReligious,isCivil
http://www.wikidata.org/entity/Q1790268,Roman–Parthian War of 161–166,,0161-01-01T00:00:00Z,0166-01-01T00:00:00Z,,Kingdom of Armenia,"Ancient Rome, Parthian Empire",Roman–Parthian Wars,Siege of Edessa  (163),,no,no
http://www.wikidata.org/entity/Q1791222,War of the Cow,1272-01-01T00:00:00Z,1272-01-01T00:00:00Z,1278-01-01T00:00:00Z,,,"County of Namur, Prince-Bishopric of Liège",,,,no,no
http://www.wikidata.org/entity/Q1805364,Franco–Lombard War of 773–774,,0773-01-01T00:00:00Z,0774-01-01T00:00:00Z,,Italian Peninsula,"Kingdom of the Lombards, Francia",Franco-Lombard Wars,"Siege of Pavia (773–774), Battle of Chiusa di San Michele",,no,no
http://www.wikidata.org/entity/Q1809288,Ottoman-Saudi War,,1811-08-01T00:00:00Z,1818-08-01T00:00:00Z,,Arabian Peninsula,,,"Siege of Taif, Nejd Expedition, Battle of Yanbu, Battle of Byssel, Battle of Mecca (1813), Battle of Medina, Battle of Al-Safra",,no,no
http://www.wikidata.org/entity/Q1814745,Eelam War I,1983-07-23T00:00:00Z,1983-07-23T00:00:00Z,1987-07-29T00:00:00Z,,Sri Lanka,"Liberation Tigers of Tamil Eelam, Sri Lanka",Sri Lankan Civil War,,,no,no
http://www.wikidata.org/entity/Q1837308,Rus'–Byzantine War (941),0941-01-01T00:00:00Z,0941-01-01T00:00:00Z,0944-01-01T00:00:00Z,,Constantinople,"Byzantine Empire, Kievan Rus'",Rus'–Byzantine War,,,no,no
http://www.wikidata.org/entity/Q1849379,Travancore–Dutch War,,,,Netherlands,,"Dutch East India Company, Kingdom of Thiruvithamkoor",,Battle of Colachel,,no,no
http://www.wikidata.org/entity/Q1851858,Dakota War of 1862,1862-01-01T00:00:00Z,1862-08-17T00:00:00Z,1862-12-26T00:00:00Z,,"Dakota Territory, Minnesota","United States of America, Dakota people","Sioux Wars, American Civil War","Battle of Wood Lake, Battle of Lower Sioux Agency, Battles of New Ulm, Battle of Redwood Ferry, Battle of Acton, Battle of Birch Coulee, Battle of Fort Ridgely","150, 77",no,no
http://www.wikidata.org/entity/Q1891008,Sand War,1963-10-01T00:00:00Z,1963-09-25T00:00:00Z,1964-02-20T00:00:00Z,,Tindouf Province,"Morocco, Cuba, France, Egypt, Algeria","Arab Cold War, Algerian–Moroccan conflicts",,,no,no
http://www.wikidata.org/entity/Q1921983,Merovingian Brothers War,,,,,,,,,,no,no
http://www.wikidata.org/entity/Q1922071,Indo-Pakistani War of 1971,1971-12-16T00:00:00Z,1971-12-03T00:00:00Z,1971-12-16T00:00:00Z,,"Bay of Bengal, Indo-Bangladesh enclaves, Arabian Sea, Bangladesh–India border, India–Pakistan border, Line of Control","Pakistan, India",,"INS Khukri, Indo-Pakistani Naval War of 1971, Operation Python, Operation Trident, Battle of Longewala, Tangail Airdrop, Battle of Chamb, Meghna Heli Bridge, Battle of Basantar, Operation Chengiz Khan",,no,no
http://www.wikidata.org/entity/Q1925514,Third War of the Diadochi,,-0313-01-01T00:00:00Z,-0310-01-01T00:00:00Z,,,"Antipatrid dynasty, Ptolemaic dynasty, Antigonid dynasty",Wars of the Diadochi,"Siege of Tyre (314–313 BC), Battle of Myus, Battle of Gaza, Battle of Aphrodisias",,no,no
http://www.wikidata.org/entity/Q1933729,Polish–Czechoslovak War,1919-01-30T00:00:00Z,1919-01-23T00:00:00Z,1919-01-30T00:00:00Z,,Cieszyn Silesia,"Second Polish Republic, First Czechoslovak Republic",Polish–Czechoslovak border conflicts,Battle of Skoczów,,no,no
http://www.wikidata.org/entity/Q1936011,Cold War (1962–1979),,1962-01-01T00:00:00Z,1979-01-01T00:00:00Z,,,,,,,no,no
http://www.wikidata.org/entity/Q1949299,Russo-Kazan Wars,1439-01-01T00:00:00Z,1438-01-01T00:00:00Z,1552-01-01T00:00:00Z,,,"Grand Principality of Moscow, Khanate of Qazan",,"Russo-Kazan War (1505–07), Siege of Kazan, Battle of Suzdal, Kazan Rebellion of 1552–1556, Siege of Moscow (1439)",,no,no
http://www.wikidata.org/entity/Q1957205,Donia war,,1458-01-01T00:00:00Z,1464-01-01T00:00:00Z,Netherlands,,,,,,no,no
http://www.wikidata.org/entity/Q1962178,Russian-Chukchi War,,,,,,,,"Battle of Yegach, 1702 Alexey Chudinov's campaign against the Chukchi, Battle on the Orlova River",,no,no
http://www.wikidata.org/entity/Q1962709,Ingrian War,1610-01-01T00:00:00Z,1610-01-01T00:00:00Z,1617-01-01T00:00:00Z,,Russia,"Swedish Empire, Tsardom of Russia",Russo-Swedish Wars,"Capture of Novgorod (1611), Siege of Gdov, Battle of Bronnitsy, Siege of Pskov, Siege of Tikhvin",,no,no
http://www.wikidata.org/entity/Q1966558,Saltpeter War,,1480-01-01T00:00:00Z,1510-01-01T00:00:00Z,Mexico,,"Tapalpa, Zapotlán El Grande Municipality, Sayula, Tarascan State, Colima, Autlán de Navarro",,,,no,no
http://www.wikidata.org/entity/Q1967193,Second conflict in the Goryeo–Khitan War,1010-01-01T00:00:00Z,1010-01-01T00:00:00Z,1011-01-01T00:00:00Z,,Korean Peninsula,"Goryeo, Liao dynasty",Goryeo–Khitan War,,,no,no
http://www.wikidata.org/entity/Q1967504,Third conflict in the Goryeo–Khitan War,1018-01-01T00:00:00Z,,,,,,Goryeo–Khitan War,Battle of Kuju,,no,no
http://www.wikidata.org/entity/Q1968718,Great Syrian Revolt,1925-07-19T00:00:00Z,,,State of Syria,French Mandate for Syria and the Lebanon,,,"Battle of al-Mazraa, Battle of al-Musayfirah, Battle of Rashaya, 1925 Hama uprising, Battle of al-Kafr, Battle of Salkhad",,no,no
http://www.wikidata.org/entity/Q1972316,Gran Colombia–Peru War,,1828-05-20T00:00:00Z,1829-09-22T00:00:00Z,,"Pacific Ocean, South District, Guayaquil Department, Azuay Department","Peru, Gran Colombia","Ecuadorian–Peruvian territorial dispute, Colombian–Peruvian territorial dispute","Battle of Punta Malpelo, Battle of Cruces, Girón Accord, Battle of Tarqui",,no,no
http://www.wikidata.org/entity/Q1991457,Baussenque Wars,,1144-01-01T00:00:00Z,1162-01-01T00:00:00Z,,,,,,,no,no
http://www.wikidata.org/entity/Q1997806,North German Margrave War,,1308-01-01T00:00:00Z,1317-01-01T00:00:00Z,,,"Kingdom of Denmark, Stralsund, Wismar, Rostock, House of Mecklenburg, Teutonic Order, House of Griffins, Margraviate of Brandenburg",,,,no,no
http://www.wikidata.org/entity/Q2013633,Salt War (1611),,,,,,"Archbishopric of Salzburg, Duchy of Bavaria",,,,no,no
http://www.wikidata.org/entity/Q2018187,Civil war between Alba and Cornwall,,,,,,,,,,no,no
http://www.wikidata.org/entity/Q2022781,Civil war of the weak king,,,,,,,,,,no,no
http://www.wikidata.org/entity/Q2032554,Second Melillan campaign,,1909-07-09T00:00:00Z,1910-01-01T00:00:00Z,,Rif,"Spain, Riffian people",Spanish–Moroccan conflicts,"Battle of Wolf Ravine, cavalry charge of Taxdirt",,no,no
http://www.wikidata.org/entity/Q2038126,Tuscarora War,,1711-09-10T00:00:00Z,1715-02-11T00:00:00Z,Kingdom of Great Britain,Eastern North Carolina,"Province of North Carolina, Tuscarora people, Province of South Carolina",American Indian Wars,,,no,no
http://www.wikidata.org/entity/Q2040276,Great Frisian War,1413-01-01T00:00:00Z,1413-01-01T00:00:00Z,1422-01-01T00:00:00Z,,Frisia,"Van Heeckeren, tom Brok, Vetkopers and Schieringers, van Bronckhorst",,,,no,no
http://www.wikidata.org/entity/Q2045508,Java War,,1825-01-01T00:00:00Z,1830-01-01T00:00:00Z,,,"Javanese, Dutch colonial empire",Dutch East Indies campaign,,,no,no
http://www.wikidata.org/entity/Q2060306,Red Cloud's War,1866-01-01T00:00:00Z,1866-01-01T00:00:00Z,1868-01-01T00:00:00Z,United States of America,"Bozeman Trail, Bighorn River, Powder River Country","Sioux, United States of America, Cheyennes, Red Cloud, Crazy Horse, Arapaho people, Lakota people",Sioux Wars,"Battle of Crazy Woman Creek, Wagon Box Fight, Hayfield Fight, Fetterman Fight",,no,no
http://www.wikidata.org/entity/Q2071183,First Münster War,,1665-09-23T00:00:00Z,,Netherlands,,,,,,no,no
http://www.wikidata.org/entity/Q2073517,War against Nabis,-0194-01-01T00:00:00Z,,,,Laconia prefecture,"Aetolian League, Pergamon, Achaean League, Sparta, Argos, Rhodes, Ancient Rome, Macedonia",,Battle of Gythium,,no,no
http://www.wikidata.org/entity/Q2075775,Second Messenian War,,-0684-01-01T00:00:00Z,-0667-01-01T00:00:00Z,,Peloponnese,"Ancient Elis, Messenia, Sparta, Argos, Lepreon, Arcadia, Sicyon, Ancient Corinth",Messenian Wars,"Battle of Deres, Battle of the Boar's Grave",,no,no
http://www.wikidata.org/entity/Q2078442,Second Dacian War,,0105-01-01T00:00:00Z,0106-01-01T00:00:00Z,,Dacia,,Trajan's Dacian Wars,,,no,no
http://www.wikidata.org/entity/Q2082222,Lazic War,,0541-01-01T00:00:00Z,0562-01-01T00:00:00Z,,Colchis,"Lazica, Byzantine Empire, Sasanian Empire, Sabir people","Byzantine–Sassanian Wars, Roman–Persian Wars","Siege of Petra (541), Siege of Petra (550–551), Siege of Petra, Battle of Telephis–Ollaria, Siege of Onoguris, Yawm Halima, Siege of Phasis, Siege of Edessa (544)",,no,no
http://www.wikidata.org/entity/Q2090475,Second Franco-Dahomean War,,1892-07-04T00:00:00Z,1894-01-15T00:00:00Z,,Ouémé Department,"French Third Republic, Dahomey",Scramble for Africa,,,no,no
http://www.wikidata.org/entity/Q2092093,Mongol invasions and conquests,,1206-01-01T00:00:00Z,1337-01-01T00:00:00Z,,Eurasia,,,"Mongol conquest of Anatolia, Battle of Mohi, Mongol invasion of Europe, Kublai Khan's Campaigns, Mongol invasions of Japan, Battle of the Kalka River, Mongol invasions of Georgia, Mongol conquest of Persia, Mongol invasion of China, Mongol invasions of Korea, Second Mongol invasion of Burma, Mongol campaign against the Nizaris, Mongol invasions of Vietnam, Mongol invasions of India, Mongol invasion of Java, First Mongol invasion of Burma, Mongol invasions of Sakhalin, Siege of Baghdad (1258), Battle of Ain Jalut, Battle of Legnica, Mongol invasion of Central Asia, Mongol raids into Palestine",,no,no
http://www.wikidata.org/entity/Q2096286,Theater War,1788-09-24T00:00:00Z,1788-09-24T00:00:00Z,1789-07-09T00:00:00Z,,Sweden,"Denmark–Norway, Sweden",Russo-Swedish War of 1788–1790,Battle of Kvistrum,,no,no
http://www.wikidata.org/entity/Q2103340,Pomeranian-Brandenburg War,,,,,,,,,,no,no
http://www.wikidata.org/entity/Q2105495,1383-85 Portuguese Interregnum,1383-04-10T00:00:00Z,1383-04-01T00:00:00Z,1385-10-01T00:00:00Z,,Portugal,"Kingdom of Portugal, Crown of Castile",Hundred Years' War,"Battle of Atoleiros, Battle of Aljubarrota, Battle of Valverde, Naval Battle of the Tejo, Battle of Trancoso, Battle of Leça, Siege of Lisbon, Galician campaign",,no,"yes, no"
http://www.wikidata.org/entity/Q2109300,Prussian invasion of Holland,1787-10-10T00:00:00Z,1787-09-13T00:00:00Z,1787-10-10T00:00:00Z,,Dutch Republic,"Patriots, States of Holland and West Friesland, Kingdom of Prussia, Orangism",,,,no,no
http://www.wikidata.org/entity/Q2156243,"Eighty Years' War, 1572–1576",,1572-08-01T00:00:00Z,1576-11-01T00:00:00Z,Seventeen Provinces,,,Eighty Years' War,,,no,no
http://www.wikidata.org/entity/Q2201391,Dutch intervention in Lombok and Karangasem,1894-11-01T00:00:00Z,,,,Lombok Island,,,"Second Lombok expedition, First Lombok expedition",,no,no
http://www.wikidata.org/entity/Q2253578,Second Bone War,,,,,,,,,,no,no
http://www.wikidata.org/entity/Q2255662,Pig War,,,,,,,,,,no,no
http://www.wikidata.org/entity/Q2258636,Second Mafia War,,1981-04-23T00:00:00Z,1984-01-01T00:00:00Z,Italy,,Corleonesi,,,500,no,no
http://www.wikidata.org/entity/Q2259304,Edwardian War,1337-01-01T00:00:00Z,1337-01-01T00:00:00Z,1360-01-01T00:00:00Z,,France,"Duchy of Brittany, Republic of Genoa, Kingdom of England, County of Hainaut, Kingdom of France, Crown of Castile, Kingdom of Majorca, Kingdom of Bohemia, Kingdom of Navarre, County of Flanders, Kingdom of Scotland, Duchy of Lorraine",Hundred Years' War,Black Monday,,no,no
http://www.wikidata.org/entity/Q2270170,Sino-Nepalese War,,1788-01-01T00:00:00Z,1789-01-01T00:00:00Z,Qing dynasty,"Xigazê, Tibet","Qianlong Emperor, Tibetan people, Fuk'anggan, Gurkha, Hailanqa, Prince Bahadur Shah of Nepal",Ten Great Campaigns,,,no,no
http://www.wikidata.org/entity/Q2280712,Burma-Siamese War,,,,,,,,,,no,no
http://www.wikidata.org/entity/Q2280714,Burmese–Siamese War (1594–1605),1600-05-01T00:00:00Z,1594-01-01T00:00:00Z,1605-01-01T00:00:00Z,,,"Ayutthaya Kingdom, Taungoo dynasty",Burmese–Siamese wars,,,no,no
http://www.wikidata.org/entity/Q2280723,Burmese–Siamese War (1785–86),1785-01-01T00:00:00Z,1785-01-01T00:00:00Z,1786-01-01T00:00:00Z,,Lanna,"Thailand, Konbaung dynasty",Burmese–Siamese wars,Ta Din Dang campaign,,no,no
http://www.wikidata.org/entity/Q2280725,Siamese–Vietnamese War,,1771-10-01T00:00:00Z,1773-03-01T00:00:00Z,,"Cambodia, Southern Vietnam",,Siamese-Vietnamese wars,,,no,no
http://www.wikidata.org/entity/Q2288424,War of the Eight Saints,1378-07-01T00:00:00Z,1375-01-01T00:00:00Z,1378-07-01T00:00:00Z,,Italian Peninsula,"Republic of Siena, Papal States, Republic of Florence, Milan",,Cesena massacre,,no,no
http://www.wikidata.org/entity/Q2291971,Battle of Ilerda,,-0048-06-01T00:00:00Z,-0048-08-01T00:00:00Z,Spain,Lleida,populares,Caesar's civil war,,,no,no
http://www.wikidata.org/entity/Q2309409,Morean War,,1684-04-25T00:00:00Z,1699-01-26T00:00:00Z,,"Albania, Aegean Sea, Central Greece, Peloponnese, Venetian Dalmatia","Montenegrins, Papal States, Ottoman Empire, Order of Hospitallers, Order of Saint Stephen, Duchy of Savoy, Republic of Venice","Great Turkish War, Ottoman–Venetian Wars","Battle of Cape Baba, Action of 6 July 1697, Siege of Knin, Battle of Tenedos (1698), Battle of Andros (1696), Battle of the Oinousses Islands, Siege of Castelnuovo, Siege of Santa Maura, Battle of Samothrace, Battle of Andros (1697), Battle of Kalamata (1685), Battle of Icaria, Siege of the Acropolis (1687), Siege of Negroponte",,no,no
http://www.wikidata.org/entity/Q2312422,Third Perso-Turkic War,,,,,South Caucasus,Sasanian Empire,"Byzantine–Sassanid War of 602–628, Perso-Turkic Wars",,,no,no
http://www.wikidata.org/entity/Q2318299,Rorschacher Klosterbruch,1489-08-06T00:00:00Z,1489-08-06T00:00:00Z,1490-01-01T00:00:00Z,,Rorschach,"Zürich, Appenzell, St. Gallen, Glarus, Schwyz, Abbey of Saint Gall, Lucerne",,,,no,no
http://www.wikidata.org/entity/Q2320020,Byzantine–Sassanid War of 572–591,,0572-01-01T00:00:00Z,0591-01-01T00:00:00Z,,Mesopotamia,"Lakhmids, Ghassanids, Byzantine Empire, Sasanian Empire",Byzantine–Sassanian Wars,"Siege of Nisibis, Battle of Martyropolis, Battle of Solachon, Battle of the Blarathon, Siege of Dara",,no,no
http://www.wikidata.org/entity/Q2320981,Williamite War in Ireland,1691-10-03T00:00:00Z,1689-03-12T00:00:00Z,1691-10-03T00:00:00Z,,Kingdom of Ireland,"Dutch Republic, Kingdom of England, Kingdom of France, Jacobitism, Kingdom of Scotland",Nine Years' War,"Siege of Derry, Siege of Cork, Battle of the Boyne, Siege of Athlone, Capture of Waterford, Battle of Aughrim, Battle of Newtownbutler, Break of Dromore, Battle of Cavan, Battle of Bantry Bay, Raid on Newry, Siege of Carrickfergus, Capture of Bandon, Siege of Limerick",,no,no
http://www.wikidata.org/entity/Q2321496,Bannock War,,1878-06-01T00:00:00Z,1878-09-01T00:00:00Z,,Idaho,"Shoshone, Bannock people, Northern Paiute, United States of America",American Indian Wars,,,no,no
http://www.wikidata.org/entity/Q2326066,Iberian War,,0526-01-01T00:00:00Z,0532-01-01T00:00:00Z,,"Mesopotamia, South Caucasus, Kingdom of Iberia","Byzantine Empire, Kingdom of Aksum, Belisarius, Ghassanids, Heruli, Sabir people, Kingdom of Iberia, Lakhmids, Sittas, Sasanian Empire, Huns",Roman–Persian Wars,"Battle of Callinicum, Battle of Mindouos, Battle of Satala, Battle of Dara, Battle of Thannuris",,no,no
http://www.wikidata.org/entity/Q2326099,Byzantine–Sassanid War of 602–628,,0602-01-01T00:00:00Z,0628-01-01T00:00:00Z,,"Asia Minor, Mesopotamia, Aegean Sea, Roman Egypt, Levant, Balkans","Avar Khaganate, Byzantine Empire, Arabs, Sclaveni, Jewish people, Sasanian Iberia, Western Turkic Khaganate, Sasanian Empire",Byzantine–Sassanian Wars,"Battle of Nineveh, Jewish revolt against Heraclius, Third Perso-Turkic War, Heraclius' campaign of 622, Sassanid conquest of Egypt, Siege of Constantinople (626), Shahin's invasion of Asia Minor, Battle of Antioch",,no,no
http://www.wikidata.org/entity/Q2330335,Mongol invasion of Central Asia,1216-01-01T00:00:00Z,1216-01-01T00:00:00Z,1221-01-01T00:00:00Z,,Central Asia,"Mongol Empire, Khwarazmian dynasty, Qara Khitai",Mongol invasions and conquests,"Battle of Kili, Mongol conquest of the Kara-Khitai, Mongol invasion of Khwarezmia and Eastern Iran, Battle of Beas River",,no,no
http://www.wikidata.org/entity/Q2330558,Liège Wars,,,,,Prince-Bishopric of Liège,"Prince-Bishopric of Liège, Duchy of Burgundy",,"Battle of Montenaken, 600 Franchimontois, Battle of Brustem",,no,no
http://www.wikidata.org/entity/Q2334699,Antony's Parthian War,-0035-01-01T00:00:00Z,,,,"Mesopotamia, Atropatene, Levant, Anatolia","Ancient Rome, Parthian Empire",Roman–Parthian Wars,"Battle of Fraaspa, Battle of Urumia",,no,no
http://www.wikidata.org/entity/Q2337340,Cenepa War,1995-02-28T00:00:00Z,1995-01-26T00:00:00Z,1995-02-28T00:00:00Z,"Peru, Ecuador","Cenepa River, Ecuador–Peru border, Condorcanqui Province","Peru, Ecuador",Ecuadorian–Peruvian territorial dispute,,,no,no
http://www.wikidata.org/entity/Q2338771,Cretan War (205–200 BC),,-0204-01-01T00:00:00Z,-0199-01-01T00:00:00Z,,Crete,"Athens, Olous, Aetolian League, Knossos, Ierapetra, Acarnania, Byzantium, Pergamon, Cyzicus, Sparta, Rhodes, Macedonia",,"Battle of Chios, Battle of Lade, Siege of Abydos",,no,no
http://www.wikidata.org/entity/Q2342102,Indochina Wars,,1946-01-01T00:00:00Z,1989-01-01T00:00:00Z,,Southeast Asia,"United States of America, Communist Party of Thailand, National Liberation Front of South Vietnam, Laos, Lao Issara, Kingdom of Cambodia, Thailand, People's Republic of Kampuchea, Democratic Kampuchea, People's Republic of China, GRUNK, United Front for the Liberation of Oppressed Races, French Fourth Republic, Vietnamese Independence League, Khmer Republic, Khmer Issarak, Philippines, New Zealand, Khmer Rouge, State of Vietnam, South Korea, Kingdom of Laos, Republic of Vietnam, North Vietnam, Vietnam, Royal Lao Government in Exile, Australia, North Korea, Pathet Lao",,"War in Vietnam (1945–1946), Third Indochina War, First Indochina War, Cambodian Civil War",,no,no
http://www.wikidata.org/entity/Q2345065,Second Illyro-Roman War,,-0219-01-01T00:00:00Z,-0218-01-01T00:00:00Z,,,,Illyro-Roman Wars,,,no,no
http://www.wikidata.org/entity/Q2345847,Star Wars,,,,,,,,,,no,no
http://www.wikidata.org/entity/Q2356791,Portuguese conquest of the Banda Oriental,1816-01-01T00:00:00Z,1816-08-28T00:00:00Z,1820-03-03T00:00:00Z,,Uruguay,,,"Battle of Catalán, Battle of Apósteles, Battle of Pablo Perez, Battle of Ibicuí River, Battle of Sauce, Battle of Ibiraocaí, Battle of India Muerta, Battle of San Carlos, Battle of Arapey, Battle of Arroyo Grande, Battle of Tacuarembó, Battle of Santa Ana, Battle of Itacurubi, Battle of Carumbé",,no,no
http://www.wikidata.org/entity/Q2362482,First Persian invasion of Greece,,-0491-01-01T00:00:00Z,-0489-01-01T00:00:00Z,,Thrace,"Athens, Achaemenid Empire, Eretria",Greco-Persian Wars,Battle of Marathon,,no,no
http://www.wikidata.org/entity/Q2367321,English-Manipur war,,1890-01-01T00:00:00Z,1891-01-01T00:00:00Z,,,,,,,no,no
http://www.wikidata.org/entity/Q2367618,Pannonian War,,-0013-01-01T00:00:00Z,-0009-01-01T00:00:00Z,,,,,,,no,no
http://www.wikidata.org/entity/Q2373506,Polish–Swedish War (1617-18),1617-01-01T00:00:00Z,1617-01-01T00:00:00Z,1618-01-01T00:00:00Z,,Duchy of Livonia,"Polish–Lithuanian Commonwealth, Sweden",Polish–Swedish War (1600-29),,,no,no
http://www.wikidata.org/entity/Q2394391,Rus'–Byzantine War (1024),1024-01-01T00:00:00Z,,,,Lemnos,"Byzantine Empire, Kievan Rus'",,,,no,no
http://www.wikidata.org/entity/Q2402416,Teltow and Magdeburg Wars,,1239-01-01T00:00:00Z,1244-01-01T00:00:00Z,,,"Henry III, John I, Margrave of Brandenburg, Wilbrand of Käfernburg, Otto III, Margrave of Brandenburg",,,,no,no
http://www.wikidata.org/entity/Q2407681,War between Lagash and Umma,,-2500-01-01T00:00:00Z,-2500-01-01T00:00:00Z,,Mesopotamia,"Umma, Lagash",,,,no,no
http://www.wikidata.org/entity/Q2407716,Roman–Sassanid War,,0421-01-01T00:00:00Z,0422-01-01T00:00:00Z,,,"Lakhmids, Byzantine Empire, Sasanian Empire",Roman–Persian Wars,,,no,no
http://www.wikidata.org/entity/Q2419855,Ukrainian–Soviet War,1917-11-08T00:00:00Z,1917-01-01T00:00:00Z,1921-01-01T00:00:00Z,,Ukraine,"Makhnovshchina, Second Polish Republic, German Empire, Ukrainian Soviet Socialist Republic, Russian Soviet Federative Socialist Republic, Armed Forces of South Russia, Ukrainian People's Republic","Ukrainian War of Independence, Ukraine after the Russian Revolution","Battle of Kyiv (1918), Odessa Bolshevik Uprising, Kyiv Arsenal January Uprising, Anti-Hetman Uprising, Battle of Kruty",,no,no
http://www.wikidata.org/entity/Q2422135,War of the Araucania,1881-11-03T00:00:00Z,,,Chile,Araucanía Region,Mapuche,,,,no,no
http://www.wikidata.org/entity/Q2427419,Guaraní War,1756-02-01T00:00:00Z,,,,Misiones Orientales,"Guaraní adrian, Kingdom of Portugal, Enlightenment in Spain",,Real Cédula de creación del Gobierno de Misiones,,no,no
http://www.wikidata.org/entity/Q2430799,Thuringian Counts' War,,1342-01-01T00:00:00Z,1346-01-01T00:00:00Z,,,House of Wettin,,,,no,no
http://www.wikidata.org/entity/Q2441248,Anglo-Russian War (1807–1812),1807-09-02T00:00:00Z,1807-09-02T00:00:00Z,1812-07-18T00:00:00Z,,Finland,"Russian Empire, United Kingdom of Great Britain and Ireland",Napoleonic Wars,,,no,no
http://www.wikidata.org/entity/Q3305554,Byzantine civil war of 1373–1379,1373-01-01T00:00:00Z,1373-01-01T00:00:00Z,1379-01-01T00:00:00Z,,Constantinople,"Republic of Genoa, Andronikos IV Palaiologos, Ottoman Empire, John V Palaiologos, Savcı Bey, Republic of Venice",list of Byzantine revolts and civil wars,,,no,no
http://www.wikidata.org/entity/Q3312328,Spanish conquest of Iberian Navarre,1512-01-01T00:00:00Z,,,,Kingdom of Navarre,"Kingdom of Navarre beyond the Pyrenees, Kingdom of Navarre, Crown of Castile, Crown of Aragon",War of the League of Cambrai,"Battle of Esa, Siege of Saint-Jean-Pied-de-Port, Battle of Noáin, Battle of Pamplona, Siege of Maya",,no,no
http://www.wikidata.org/entity/Q3312857,Friso-Hollandic Wars,1256-01-01T00:00:00Z,,,Netherlands,Netherlands,Holy Roman Empire,,,,no,no
http://www.wikidata.org/entity/Q3365438,War in Vietnam (1945–1946),1945-09-13T00:00:00Z,1945-09-13T00:00:00Z,1946-03-30T00:00:00Z,,Southern Vietnam,"Vietnamese Independence League, France, United Kingdom",Indochina Wars,,,no,no
http://www.wikidata.org/entity/Q3381219,Siamese–Vietnamese War,1831-01-01T00:00:00Z,1831-01-01T00:00:00Z,1834-01-01T00:00:00Z,,Cambodia,"Siam, Nguyen dynasty",Siamese-Vietnamese wars,,,no,no
http://www.wikidata.org/entity/Q3401862,Wars between Rome and the Veii,,,-0395-01-01T00:00:00Z,,Etruria,"Ancient Rome, Veii",Roman-Etruscan Wars,"Third Veyent War, Second Veyent War, First Veyentian War, Battle of the Janiculum",,no,no
http://www.wikidata.org/entity/Q3417663,Roman–Gallic wars,,,http://www.wikidata.org/.well-known/genid/e259f32a5414f463d78ce2a095358ef7,,Europe,"Ancient Rome, Ancient Celts",,"Battle of Mutina, Battle of Lake Vadimo, Battle of Placentia, Siege of Rome (390 BC), Battle of Cremona, Battle of Arretium, Battle of the Aniene, Battle of Faesulae, Battle of Clastidium, Battle of the Allia",,no,no
http://www.wikidata.org/entity/Q3427966,transition from Ming to Qing,,1616-01-01T00:00:00Z,1683-01-01T00:00:00Z,,China,,,"Wuqiao Mutiny, Battle of Qinghe, Battle of Dalinghe, Battle of Tieling, Battle of Shen-Liao, Battle of Shanhai Pass, Battle of Xicheng, Battle of Kaiyuan, Battle of Ning-Jin, Battle of Songjin, Battle of Guangning, Battle of Ningyuan, Battle of Fort Zhenjiang, Revolt of the Three Feudatories, Jisi Incident, Battle of Sarhu, Battle of Fushun",,no,no
http://www.wikidata.org/entity/Q3429692,55 Day War,,1993-01-09T00:00:00Z,1993-03-06T00:00:00Z,,Angola,,Angolan Civil War,,,no,no
http://www.wikidata.org/entity/Q3439047,Dominican War of Independence,1844-01-01T00:00:00Z,1844-01-01T00:00:00Z,1856-01-01T00:00:00Z,"Haiti, Dominican Republic",Hispaniola,"Dominican Republic, Haiti",,"Battle of Santomé, Battle of Cabeza de Las Marías, Battle of Tortuguero, Battle of Sabana Larga, Battle of Azua, Battle of Fuente del Rodeo, Battle of Beler, Battle of Las Carreras, Battle of El Númeroverga, Battle of Fort Cachimán, Battle of Estrelleta",,no,no
http://www.wikidata.org/entity/Q3458266,Cretan Revolt (1841),,,,,,,,,,no,no
http://www.wikidata.org/entity/Q3458306,Mokrani Revolt,,,,,French Algeria,,French conquest of Algeria,Battle of the Col des Beni Aïcha (1871),,no,no
http://www.wikidata.org/entity/Q3477062,Second Veyent War,,,,,,"Ancient Rome, Veii",Wars between Rome and the Veii,,,no,no
http://www.wikidata.org/entity/Q3499292,Byzantine civil war of 1321–1328,1321-01-01T00:00:00Z,1321-01-01T00:00:00Z,1328-01-01T00:00:00Z,,Thrace,"Second Bulgarian Empire, Andronikos II Palaiologos, Kingdom of Serbia, Andronikos III Palaiologos",list of Byzantine revolts and civil wars,,,no,no
http://www.wikidata.org/entity/Q3502774,Hundred Years' Croatian–Ottoman War,1493-01-01T00:00:00Z,1493-01-01T00:00:00Z,1593-01-01T00:00:00Z,,Croatia in personal union with Hungary,"Ottoman Empire, Kingdom of Croatia",Croatian-Ottoman Wars,"Battle of Una, Battle of Sisak",,no,no
http://www.wikidata.org/entity/Q3506411,Great French War,,1792-01-01T00:00:00Z,1815-01-01T00:00:00Z,,,,,,,no,no
http://www.wikidata.org/entity/Q3540196,Seventh Sicilian War,,-0310-01-01T00:00:00Z,-0305-01-01T00:00:00Z,,"North Africa, Sicily",,Greek-Punic Wars,"Expeditions of Agathocles to Africa, Massacre of Segesta, Battle of Himera, First landing of Agathocles in Western Sicily, Second landing of Agathocles in Western Sicily, Siege of Syracuse, Battle of White Tunis, Battle of Tunis",,no,no
